{
  "artifact_id": "synthesis-candidate-parity:f000477:national_security_foreign:119:v1",
  "entries": [
    {
      "content_subject_sha256": "662917b23193042cd8bfd2b8db3666fa951351ef988fe37056902236109ea1ad",
      "file_sha256": "e5cfd7305babb5690d496a02b3c1dcc056d4368d980f0d25e5dd1c8d988345c8",
      "path": "synthesis_candidate_package.json"
    },
    {
      "content_subject_sha256": "0a1bbbf303fb5ddb364fc646d67d74c8f8b0d5e40164a257ea413ed01f566a39",
      "file_sha256": "9727717a17b5cbf48786f8eee0f1ece71f347dff1d9fceec983eaa060f2f3a11",
      "path": "human_synthesis_decision_template.json"
    },
    {
      "content_subject_sha256": null,
      "file_sha256": "a89e849ce41e6b2e83542b2497e36d8882a37715eddeb94f12c8765796135d3c",
      "path": "human_review_dossier.md"
    }
  ],
  "package_binding": {
    "artifact_id": "synthesis-candidates:f000477:national_security_foreign:119:v1",
    "synthesis_candidate_package_subject_sha256": "662917b23193042cd8bfd2b8db3666fa951351ef988fe37056902236109ea1ad"
  },
  "parity_subject_sha256": "eb857e98f7a1c824116537967d08c61bb6d846eb47f08be359c04bc38ead4ea4",
  "schema_version": "full_record_synthesis_candidate_parity_v1"
}
